{
  "registryId": "HDIP-CLA-0.1-A1-ARCHITECTURE-ELEMENT-REGISTRY",
  "registryVersion": "0.1-A1",
  "status": "A1_COMPLETE",
  "humanReadableAuthority": {
    "baseline": "HDIP-CLA 0.1 human-readable architecture baseline",
    "freezeStage": "M17",
    "sourceDocument": "docs/architecture/cla/hdip-cla-0.1-m17-cross-artifact-reconciliation-freeze.md",
    "precedenceRule": "If a machine-readable artifact conflicts with the frozen human-readable baseline, the human-readable baseline governs until a governed correction/version change."
  },
  "identityPolicy": {
    "reuseFrozenSourceIdentifiers": true,
    "machineAssignedIdentifierPrefix": "HDIP-CLA-",
    "machineAssignedIdentifiersCreateNoNewArchitectureMeaning": true,
    "iriAssignmentDeferredTo": "A5",
    "relationshipSemanticsDeferredTo": "A2",
    "invariantExecutableSemanticsDeferredTo": "A3/A6/A12"
  },
  "elementKindOrder": [
    "PLANE",
    "FOUNDATION",
    "OVERLAY",
    "ARCHITECTURE_BUILDING_BLOCK",
    "LOGICAL_REGISTRY",
    "REGISTRY_SPECIALIZATION",
    "ARCHITECTURE_CONSTRUCT",
    "PROJECTION_COMPILATION_ARTIFACT",
    "LIFECYCLE",
    "EXPERIENCE_PROJECTION",
    "LIFECYCLE_PROJECTION",
    "LIFECYCLE_STAGE",
    "INTERACTION_FAMILY",
    "INTERACTION",
    "BOUNDARY_CLASS",
    "BOUNDARY_FAMILY",
    "REALIZATION_PATTERN",
    "PROFILE_PATTERN",
    "REFERENCE_VIEW",
    "REPRESENTATIVE_FLOW",
    "ARCHITECTURE_INVARIANT",
    "CONFORMANCE_SUBJECT_CLASS"
  ],
  "summary": {
    "elementCount": 209,
    "countsByKind": {
      "PLANE": 5,
      "FOUNDATION": 1,
      "OVERLAY": 9,
      "ARCHITECTURE_BUILDING_BLOCK": 22,
      "LOGICAL_REGISTRY": 5,
      "REGISTRY_SPECIALIZATION": 1,
      "ARCHITECTURE_CONSTRUCT": 3,
      "PROJECTION_COMPILATION_ARTIFACT": 7,
      "LIFECYCLE": 2,
      "EXPERIENCE_PROJECTION": 1,
      "LIFECYCLE_PROJECTION": 3,
      "LIFECYCLE_STAGE": 19,
      "INTERACTION_FAMILY": 4,
      "INTERACTION": 21,
      "BOUNDARY_CLASS": 6,
      "BOUNDARY_FAMILY": 12,
      "REALIZATION_PATTERN": 8,
      "PROFILE_PATTERN": 6,
      "REFERENCE_VIEW": 10,
      "REPRESENTATIVE_FLOW": 10,
      "ARCHITECTURE_INVARIANT": 48,
      "CONFORMANCE_SUBJECT_CLASS": 6
    },
    "controlledVocabularyCount": 13,
    "compatibilityMappingCount": 9
  },
  "controlledVocabularies": {
    "assessmentMode": [
      "STRUCTURAL",
      "HYBRID",
      "ASSESSMENT"
    ],
    "invariantResult": [
      "SATISFIED",
      "VIOLATED",
      "INDETERMINATE",
      "NOT_APPLICABLE"
    ],
    "conformanceOutcome": [
      "CONFORMANT",
      "NONCONFORMANT",
      "INDETERMINATE"
    ],
    "conformanceClaimType": [
      "CORE_ARCHITECTURE_CONFORMANCE",
      "PROFILE_CONFORMANCE",
      "REALIZATION_MAPPING_CONFORMANCE"
    ]
  },
  "compatibilityMappings": [
    {
      "historicalTerm": "SSPD",
      "mappingType": "RETIRED_TO",
      "targets": [
        "HDIP-CLA-LIFECYCLE-PDEP"
      ]
    },
    {
      "historicalTerm": "Consumer Experience Plane",
      "mappingType": "HISTORICAL_EXPANSION_OF",
      "targets": [
        "HDIP-CLA-EXPERIENCE-CEP"
      ]
    },
    {
      "historicalTerm": "DPFI / Data Product Factory & Intelligence",
      "mappingType": "RESPONSIBILITIES_MAP_TO",
      "targets": [
        "HDIP-P2-ABB-02",
        "HDIP-P2-ABB-03",
        "HDIP-P2-ABB-04"
      ],
      "notes": "Applicable overlays also participate; no single canonical replacement component."
    },
    {
      "historicalTerm": "COVP",
      "mappingType": "DECOMPOSED_TO",
      "targets": [
        "HDIP-X4",
        "HDIP-X9",
        "HDIP-P5"
      ],
      "notes": "Observability -> X4; Cost -> X9; Outcome/Value -> P5."
    },
    {
      "historicalTerm": "Data Product Registry",
      "mappingType": "DATA_PROFILE_VIEW_OF",
      "targets": [
        "HDIP-REG-01"
      ]
    },
    {
      "historicalTerm": "Resolved Product Graph",
      "mappingType": "PRODUCT_SCOPED_VIEW_OF",
      "targets": [
        "HDIP-CLA-ART-RRG"
      ]
    },
    {
      "historicalTerm": "Unified Governance Bundle (UGB)",
      "mappingType": "HISTORICAL_ALIAS_OF",
      "targets": [
        "HDIP-CLA-ART-RGB"
      ]
    },
    {
      "historicalTerm": "Logical Execution Plan",
      "mappingType": "SPECIALIZED_VIEW_OF",
      "targets": [
        "HDIP-CLA-ART-REALIZATION-PLAN"
      ]
    },
    {
      "historicalTerm": "Selected Blueprint",
      "mappingType": "SOURCE_REFERENCE_WITHIN",
      "targets": [
        "HDIP-CLA-ART-BLUEPRINT-BINDING"
      ]
    }
  ],
  "elements": [
    {
      "id": "HDIP-P1",
      "canonicalName": "Governed Intent, Definition & Authority Context",
      "kind": "PLANE",
      "canonicality": "FROZEN_SOURCE_ID",
      "status": "ACTIVE",
      "sourceId": "HDIP-P1",
      "sourceDocuments": [
        "docs/architecture/cla/hdip-cla-0.1-m06-canonical-logical-plane-derivation.md"
      ],
      "definition": "Express and carry governed purpose, meaning references, authority/accountability context and design obligations without capturing external semantic or Product authority."
    },
    {
      "id": "HDIP-P2",
      "canonicalName": "Discovery, Composition & Realization",
      "kind": "PLANE",
      "canonicality": "FROZEN_SOURCE_ID",
      "status": "ACTIVE",
      "sourceId": "HDIP-P2",
      "sourceDocuments": [
        "docs/architecture/cla/hdip-cla-0.1-m06-canonical-logical-plane-derivation.md"
      ],
      "definition": "Discover governed resources, resolve dependencies, compose, validate, compile and bind intent into realizable platform instructions/projections."
    },
    {
      "id": "HDIP-P3",
      "canonicalName": "Runtime, Formation & Execution",
      "kind": "PLANE",
      "canonicality": "FROZEN_SOURCE_ID",
      "status": "ACTIVE",
      "sourceId": "HDIP-P3",
      "sourceDocuments": [
        "docs/architecture/cla/hdip-cla-0.1-m06-canonical-logical-plane-derivation.md"
      ],
      "definition": "Execute the applicable Data processing, Information formation or Intelligence execution responsibilities while preserving their distinct semantics."
    },
    {
      "id": "HDIP-P4",
      "canonicalName": "Provision, Consumption & Integration",
      "kind": "PLANE",
      "canonicality": "FROZEN_SOURCE_ID",
      "status": "ACTIVE",
      "sourceId": "HDIP-P4",
      "sourceDocuments": [
        "docs/architecture/cla/hdip-cla-0.1-m06-canonical-logical-plane-derivation.md"
      ],
      "definition": "Expose governed capabilities/Products, onboard consumers, mediate access and integrate results with downstream human/system/workflow environments."
    },
    {
      "id": "HDIP-P5",
      "canonicalName": "Outcome, Value & Evolution",
      "kind": "PLANE",
      "canonicality": "FROZEN_SOURCE_ID",
      "status": "ACTIVE",
      "sourceId": "HDIP-P5",
      "sourceDocuments": [
        "docs/architecture/cla/hdip-cla-0.1-m06-canonical-logical-plane-derivation.md"
      ],
      "definition": "Observe outcomes/effectiveness/value evidence, incorporate feedback and initiate governed evolution without conflating usage, value, cost or observability."
    },
    {
      "id": "HDIP-FND",
      "canonicalName": "Shared Platform / Utility Foundation",
      "kind": "FOUNDATION",
      "canonicality": "FROZEN_SOURCE_ID",
      "status": "ACTIVE",
      "sourceId": "HDIP-FND",
      "sourceDocuments": [
        "docs/architecture/cla/hdip-cla-0.1-m06-canonical-logical-plane-derivation.md"
      ],
      "definition": "Provide common technology-neutral enabling capabilities used to realize P1-P5 and future cross-cutting Overlays."
    },
    {
      "id": "HDIP-X1",
      "canonicalName": "Governance, Policy, Control & Compliance",
      "kind": "OVERLAY",
      "canonicality": "FROZEN_SOURCE_ID",
      "status": "ACTIVE",
      "sourceId": "HDIP-X1",
      "sourceDocuments": [
        "docs/architecture/cla/hdip-cla-0.1-m07-cross-cutting-overlay-derivation.md"
      ]
    },
    {
      "id": "HDIP-X2",
      "canonicalName": "Security, Privacy, Identity & Entitlement",
      "kind": "OVERLAY",
      "canonicality": "FROZEN_SOURCE_ID",
      "status": "ACTIVE",
      "sourceId": "HDIP-X2",
      "sourceDocuments": [
        "docs/architecture/cla/hdip-cla-0.1-m07-cross-cutting-overlay-derivation.md"
      ]
    },
    {
      "id": "HDIP-X3",
      "canonicalName": "Provenance, Evidence & Traceability",
      "kind": "OVERLAY",
      "canonicality": "FROZEN_SOURCE_ID",
      "status": "ACTIVE",
      "sourceId": "HDIP-X3",
      "sourceDocuments": [
        "docs/architecture/cla/hdip-cla-0.1-m07-cross-cutting-overlay-derivation.md"
      ]
    },
    {
      "id": "HDIP-X4",
      "canonicalName": "Observability, Telemetry & Auditability",
      "kind": "OVERLAY",
      "canonicality": "FROZEN_SOURCE_ID",
      "status": "ACTIVE",
      "sourceId": "HDIP-X4",
      "sourceDocuments": [
        "docs/architecture/cla/hdip-cla-0.1-m07-cross-cutting-overlay-derivation.md"
      ]
    },
    {
      "id": "HDIP-X5",
      "canonicalName": "Quality, Fitness & Trust Evidence",
      "kind": "OVERLAY",
      "canonicality": "FROZEN_SOURCE_ID",
      "status": "ACTIVE",
      "sourceId": "HDIP-X5",
      "sourceDocuments": [
        "docs/architecture/cla/hdip-cla-0.1-m07-cross-cutting-overlay-derivation.md"
      ]
    },
    {
      "id": "HDIP-X6",
      "canonicalName": "Evaluation & Assurance",
      "kind": "OVERLAY",
      "canonicality": "FROZEN_SOURCE_ID",
      "status": "ACTIVE",
      "sourceId": "HDIP-X6",
      "sourceDocuments": [
        "docs/architecture/cla/hdip-cla-0.1-m07-cross-cutting-overlay-derivation.md"
      ]
    },
    {
      "id": "HDIP-X7",
      "canonicalName": "Lifecycle, Version, Currentness & Change",
      "kind": "OVERLAY",
      "canonicality": "FROZEN_SOURCE_ID",
      "status": "ACTIVE",
      "sourceId": "HDIP-X7",
      "sourceDocuments": [
        "docs/architecture/cla/hdip-cla-0.1-m07-cross-cutting-overlay-derivation.md"
      ]
    },
    {